{
  "$schema": "https://raw.githubusercontent.com/veg/hyphy-3/main/schemas/v3/dfel.v3.schema.json",
  "analysis": {
    "category": "selection",
    "description": "Directional FEL detects site-level selection while accounting for lineage-specific compositional heterogeneity and auto-rooting via non-reversible dynamics",
    "id": "dfel",
    "name": "Directional Fixed Effects Likelihood",
    "settings": {
      "heterogeneity_threshold": 0.05,
      "num_regimes": 3,
      "p_value_threshold": 0.1,
      "root_strategy": "auto"
    },
    "version": "3.0.0"
  },
  "compositional_heterogeneity": {
    "codon_position_1": {
      "chi2": 5.569157139065081,
      "df": 66,
      "p_value": 1.0
    },
    "codon_position_2": {
      "chi2": 4.258784554815309,
      "df": 66,
      "p_value": 1.0
    },
    "codon_position_3": {
      "chi2": 288.32510214679553,
      "df": 66,
      "p_value": 1.452219007837576e-29
    },
    "is_heterogeneous": true,
    "overall": {
      "chi2": 89.46200772233871,
      "df": 66,
      "p_value": 0.028911849578995674
    },
    "taxa": [
      {
        "gc_cp3": 0.6535433070866141,
        "gc_overall": 0.515748031496063,
        "taxon": "leb"
      },
      {
        "gc_cp3": 0.5866141732283464,
        "gc_overall": 0.505249343832021,
        "taxon": "adi"
      },
      {
        "gc_cp3": 0.594488188976378,
        "gc_overall": 0.5078740157480315,
        "taxon": "aff"
      },
      {
        "gc_cp3": 0.7952755905511811,
        "gc_overall": 0.5708661417322834,
        "taxon": "amb"
      },
      {
        "gc_cp3": 0.6732283464566929,
        "gc_overall": 0.5301837270341208,
        "taxon": "cra"
      },
      {
        "gc_cp3": 0.5905511811023622,
        "gc_overall": 0.5078740157480315,
        "taxon": "dif"
      },
      {
        "gc_cp3": 0.8267716535433071,
        "gc_overall": 0.5826771653543307,
        "taxon": "ere"
      },
      {
        "gc_cp3": 0.6023622047244095,
        "gc_overall": 0.505249343832021,
        "taxon": "het"
      },
      {
        "gc_cp3": 0.8149606299212598,
        "gc_overall": 0.5813648293963255,
        "taxon": "ma"
      },
      {
        "gc_cp3": 0.8110236220472441,
        "gc_overall": 0.5761154855643045,
        "taxon": "mel"
      },
      {
        "gc_cp3": 0.6535433070866141,
        "gc_overall": 0.5249343832020997,
        "taxon": "met"
      },
      {
        "gc_cp3": 0.610236220472441,
        "gc_overall": 0.5144356955380578,
        "taxon": "mim"
      },
      {
        "gc_cp3": 0.7637795275590551,
        "gc_overall": 0.5603674540682415,
        "taxon": "mir"
      },
      {
        "gc_cp3": 0.6141732283464567,
        "gc_overall": 0.510498687664042,
        "taxon": "nig"
      },
      {
        "gc_cp3": 0.7755905511811023,
        "gc_overall": 0.5656167979002624,
        "taxon": "per"
      },
      {
        "gc_cp3": 0.6023622047244095,
        "gc_overall": 0.510498687664042,
        "taxon": "pla"
      },
      {
        "gc_cp3": 0.7677165354330708,
        "gc_overall": 0.5616797900262467,
        "taxon": "ps"
      },
      {
        "gc_cp3": 0.5984251968503937,
        "gc_overall": 0.5026246719160105,
        "taxon": "sil"
      },
      {
        "gc_cp3": 0.8149606299212598,
        "gc_overall": 0.5787401574803149,
        "taxon": "sim"
      },
      {
        "gc_cp3": 0.6732283464566929,
        "gc_overall": 0.5288713910761155,
        "taxon": "sub"
      },
      {
        "gc_cp3": 0.8543307086614174,
        "gc_overall": 0.594488188976378,
        "taxon": "Yak"
      },
      {
        "gc_cp3": 0.7716535433070866,
        "gc_overall": 0.5643044619422573,
        "taxon": "pse"
      },
      {
        "gc_cp3": 0.6181102362204725,
        "gc_overall": 0.5118110236220472,
        "taxon": "pic"
      }
    ]
  },
  "dataset": {
    "codon_sites": 254,
    "file": "tests/data/adh.nex",
    "genetic_code": "Universal",
    "patterns_count": 241,
    "taxa_count": 23
  },
  "directional_model": {
    "regimes": [
      {
        "branch_count": 9,
        "id": 0,
        "mean_gc": 0.6766458880139982,
        "name": "AT-drift",
        "psi": -0.09179217413924963
      },
      {
        "branch_count": 26,
        "id": 1,
        "mean_gc": 0.6963955690324991,
        "name": "Neutral",
        "psi": 0.0
      },
      {
        "branch_count": 9,
        "id": 2,
        "mean_gc": 0.7463966296205162,
        "name": "GC-drift",
        "psi": 0.24929341636618396
      }
    ]
  },
  "model_fits": {
    "directional_mg94": {
      "aicc": 9670.603263286455,
      "log_likelihood": -4769.590188857158
    },
    "gtr": {
      "aicc": 10380.978674014135,
      "log_likelihood": -5138.048325771113
    }
  },
  "phylogeny": {
    "newick": "(((((((((((Yak:0.10689695,(mel:0.051130516,(sim:0.007126744,ma:0.051725496)Node6:0.013813826)Node5:0.055653808)Node4:0.067098095,ere:0.066361938)Node3:0.29173818,((((pse:0.034024856,ps:0.00010925423)Node10:0.011700289,per:0.0047758137)Node9:0.034155637,mir:0.027436472)Node8:0.10970285,(sub:0.27474355,amb:0.19483305)Node11:0.077767253)Node7:0.19757787)Node2:0.2738095,leb:0.55782789)Node1:0.34667399,met:0.42929496)Node12:0.14776464,cra:0.62538907)Node13:0.2317174,nig:0.15663625)Node14:0.10203913,mim:0.10781466)Node15:0.037277927,adi:0.1520378)Node16:0.040338511,(((sil:0.0081117426,het:0.0036755639)Node20:0.02859288,(pla:1.3847951e-05,dif:0.023527784)Node21:0.014883503)Node19:0.050683253,aff:0.091079751)Node18:0.025401652)Node17:0.072458349,pic:0.072458349)Root;",
    "root_branch": "pic",
    "root_log_likelihood": -5161.417361325926,
    "root_weight": 0.045739950732012286,
    "rooted": true,
    "tree_length": 1.364280188991029
  },
  "provenance": {
    "created_at": "2026-10-12T20:27:26.333Z"
  },
  "root_selection": {
    "candidates": [
      {
        "branch": "pic",
        "delta_log_l": 0.0,
        "is_terminal": true,
        "log_likelihood": -5161.417361325926,
        "rank": 1,
        "weight": 0.045739950732012286
      },
      {
        "branch": "het",
        "delta_log_l": 0.0018851905015253578,
        "is_terminal": true,
        "log_likelihood": -5161.419246516428,
        "rank": 2,
        "weight": 0.04565380343889496
      },
      {
        "branch": "Node18 - Node19",
        "delta_log_l": 0.0074946588019884075,
        "is_terminal": false,
        "log_likelihood": -5161.424855984728,
        "rank": 3,
        "weight": 0.045398426808906815
      },
      {
        "branch": "Node19 - Node20",
        "delta_log_l": 0.008166678233465063,
        "is_terminal": false,
        "log_likelihood": -5161.42552800416,
        "rank": 4,
        "weight": 0.04536792843283121
      },
      {
        "branch": "sil",
        "delta_log_l": 0.010521098488425196,
        "is_terminal": true,
        "log_likelihood": -5161.427882424415,
        "rank": 5,
        "weight": 0.04526123890847622
      },
      {
        "branch": "aff",
        "delta_log_l": 0.01078565440911916,
        "is_terminal": true,
        "log_likelihood": -5161.428146980335,
        "rank": 6,
        "weight": 0.0452492663635187
      },
      {
        "branch": "Node17 - Node18",
        "delta_log_l": 0.01136172729638929,
        "is_terminal": false,
        "log_likelihood": -5161.428723053223,
        "rank": 7,
        "weight": 0.04522320699476638
      },
      {
        "branch": "Node17 - Node16",
        "delta_log_l": 0.01334932620102336,
        "is_terminal": false,
        "log_likelihood": -5161.430710652127,
        "rank": 8,
        "weight": 0.04513341066718278
      },
      {
        "branch": "Node19 - Node21",
        "delta_log_l": 0.01707858271765872,
        "is_terminal": false,
        "log_likelihood": -5161.434439908644,
        "rank": 9,
        "weight": 0.044965410054727234
      },
      {
        "branch": "dif",
        "delta_log_l": 0.019548574691725662,
        "is_terminal": true,
        "log_likelihood": -5161.436909900618,
        "rank": 10,
        "weight": 0.044854482903763634
      },
      {
        "branch": "pla",
        "delta_log_l": 0.02407596774992271,
        "is_terminal": true,
        "log_likelihood": -5161.441437293676,
        "rank": 11,
        "weight": 0.044651868033901594
      },
      {
        "branch": "adi",
        "delta_log_l": 0.04185672926450934,
        "is_terminal": true,
        "log_likelihood": -5161.459218055191,
        "rank": 12,
        "weight": 0.04386494063393232
      },
      {
        "branch": "Node15 - Node14",
        "delta_log_l": 0.056618255004650564,
        "is_terminal": false,
        "log_likelihood": -5161.473979580931,
        "rank": 13,
        "weight": 0.04322218289761776
      },
      {
        "branch": "mim",
        "delta_log_l": 0.056618350957251096,
        "is_terminal": true,
        "log_likelihood": -5161.473979676884,
        "rank": 14,
        "weight": 0.04322217875033711
      },
      {
        "branch": "Node16 - Node15",
        "delta_log_l": 0.07238034206784505,
        "is_terminal": false,
        "log_likelihood": -5161.489741667994,
        "rank": 15,
        "weight": 0.04254625212174628
      },
      {
        "branch": "nig",
        "delta_log_l": 0.12476967441216402,
        "is_terminal": true,
        "log_likelihood": -5161.5421310003385,
        "rank": 16,
        "weight": 0.04037466309253008
      },
      {
        "branch": "cra",
        "delta_log_l": 0.20295566249114927,
        "is_terminal": true,
        "log_likelihood": -5161.6203169884175,
        "rank": 17,
        "weight": 0.037338181991696126
      },
      {
        "branch": "Node14 - Node13",
        "delta_log_l": 0.21145974996488803,
        "is_terminal": false,
        "log_likelihood": -5161.628821075891,
        "rank": 18,
        "weight": 0.037022001146213304
      },
      {
        "branch": "Node13 - Node12",
        "delta_log_l": 0.4582184834516738,